title,roaster,score,Roaster Location,Coffee Origin,Roast Level,Agtron,Est. Price,Review Date,Aroma,Body,Flavor,Aftertaste,With Milk,Acidity/Structure,coffee_name,coffee_review_url,coffee_brand_url,region_africa_arabia,region_caribbean,region_central_america,region_hawaii,region_asia_pacific,is_blend
Kenya AA Aries Return Espresso,Simon Hsieh Aroma Roast Coffees,96,"Taoyuan, Taiwan","Nyeri growing region, south-central Kenya",Medium,44/60,NT $950/8 ounces,November 2024,9,9,9,9,10.0,,Kenya AA Aries Return Espresso,https://www.coffeereview.com/review/kenya-aa-aries-return-espresso/,https://www.facebook.com/4ArtsZeroDefectCoffees,1,0,0,0,0,0
Kenya All’s Well Peaberry Espresso,Simon Hsieh Aroma Roast Coffees,96,"Taoyuan, Taiwan","Nyeri growing region, south-central Kenya",Medium,46/72,NT $900/8 ounces,November 2024,9,9,10,9,9.0,,Kenya All’s Well Peaberry Espresso,https://www.coffeereview.com/review/kenya-alls-well-peaberry-espresso/,https://www.facebook.com/4ArtsZeroDefectCoffees,1,0,0,0,0,0
Espresso No. 6 Finca San José Ocaña,El Gran Cafe,96,"Antigua Guatemala, Guatemala","San Juan Sacatepéquez, Antigua Department, Guatemala",Medium,50/64,$25.00/12 ounces,November 2024,9,9,9,9,10.0,,Espresso No. 6 Finca San José Ocaña,https://www.coffeereview.com/review/espresso-no-6-finca-san-jose-ocana/,https://elgran.cafe/,0,0,1,0,0,0
Guatemala Finca Santa Isabel SL28 COE #13,El Gran Cafe,93,"Antigua Guatemala, Guatemala","San Cristobal Verapaz, Alta Verapaz, Antigua Department, Guatemala",Medium,52/60,$47.00/12 ounces,November 2024,9,8,9,8,,9.0,Guatemala Finca Santa Isabel SL28 COE #13,https://www.coffeereview.com/review/guatemala-finca-santa-isabel-sl28-coe-13/,https://elgran.cafe/,0,0,1,0,0,0
Kahiko Orange,Hula Daddy Kona Coffee,98,"Holualoa, Hawai’i","Holualoa, North Kona growing district, “Big Island” of Hawai’i",Medium-Light,54/84,$99.95/8 ounces,November 2024,10,9,10,9,,10.0,Kahiko Orange,https://www.coffeereview.com/review/kahiko-orange/,http://bit.ly/2oBDGmP,0,0,0,1,0,0
Kenya Washed Yara Estate PB TOP,Kakalove Cafe,97,"Chia-Yi, Taiwan","Ruiru, Kiambu County, south-central Kenya",Medium-Light,58/80,NT $300/4 ounces,November 2024,9,9,10,9,,10.0,Kenya Washed Yara Estate PB TOP,https://www.coffeereview.com/review/kenya-washed-yara-estate-pb-top/,http://www.kakalovecafe.com.tw/,1,0,0,0,0,0
Kona Orange,Hula Daddy Kona Coffee,96,"Holualoa, Hawai’i","Holualoa, North Kona growing district, “Big Island” of Hawai’i",Light,58/84,$79.95/8 ounces,November 2024,9,9,10,9,,9.0,Kona Orange,https://www.coffeereview.com/review/kona-orange/,http://bit.ly/2oBDGmP,0,0,0,1,0,0
Colombia Wilton Benitez Sudan Rume,Utopian Coffee,96,"Fort Wayne, Indiana","Piendamo, Cauca Department, Colombia",Light,64/84,$29.00/8 ounces,November 2024,9,9,10,9,,9.0,Colombia Wilton Benitez Sudan Rume,https://www.coffeereview.com/review/colombia-wilton-benitez-sudan-rume/,https://utopiancoffee.com/,0,0,0,0,0,0
Ethiopia Washed Gute 74110 Lot JH,Kakalove Cafe,95,"Chia-Yi, Taiwan","Sidamo growing region, southern Ethiopia",Light,60/82,NT $480/8 ounces,November 2024,9,9,9,9,,9.0,Ethiopia Washed Gute 74110 Lot JH,https://www.coffeereview.com/review/ethiopia-washed-gute-74110-lot-jh/,http://www.kakalovecafe.com.tw/,1,0,0,0,0,0
Ethiopia Natural Sidama Bura Karamo 74158,Kakalove Cafe,95,"Chia-Yi, Taiwan","Sidamo growing region, southern Ethiopia",Light,57/88,NT $480/8 ounces,November 2024,9,9,9,9,,9.0,Ethiopia Natural Sidama Bura Karamo 74158,https://www.coffeereview.com/review/ethiopia-natural-sidama-bura-karamo-74158/,http://www.kakalovecafe.com.tw/,1,0,0,0,0,0
Taiwan Honey Alishan Ming Yang Yuan Gesha,Kakalove Cafe,95,"Chia-Yi, Taiwan","Alishan, Taiwan",Light,62/84,"NT $1,110/4 ounces",November 2024,9,9,9,9,,9.0,Taiwan Honey Alishan Ming Yang Yuan Gesha,https://www.coffeereview.com/review/taiwan-honey-alishan-ming-yang-yuan-gesha/,http://www.kakalovecafe.com.tw/,0,0,0,0,1,0
Kenya Washed Kiambu AB TOP Lot Yerihar,Kakalove Cafe,94,"Chia-Yi, Taiwan","Kiambu County, south-central Kenya",Medium-Light,58/78,NT $350/8 ounces,November 2024,9,9,9,8,,9.0,Kenya Washed Kiambu AB TOP Lot Yerihar,https://www.coffeereview.com/review/kenya-washed-kiambu-ab-top-lot-yerihar/,http://www.kakalovecafe.com.tw/,1,0,0,0,0,0
Kenya Ibonia Estate,Roadmap CoffeeWorks,95,"Lexington, Virginia","Kiambu County, Kenya",Medium-Light,58/80,$24.00/12 ounces,November 2024,9,9,9,9,,9.0,Kenya Ibonia Estate,https://www.coffeereview.com/review/kenya-ibonia-estate/,https://roadmapcoffeeworks.com/,1,0,0,0,0,0
Ethiopia Worka Sakaro,Roadmap CoffeeWorks,94,"Lexington, Virginia","Gedeb District, Gedeo Zone, southern Ethiopia",Light,62/86,$27.00/12 ounces,November 2024,9,9,9,9,,8.0,Ethiopia Worka Sakaro,https://www.coffeereview.com/review/ethiopia-worka-sakaro-2/,https://roadmapcoffeeworks.com/,1,0,0,0,0,0
Guatemala Washed Huehuetenango Joya Verde,Kakalove Cafe,94,"Chia-Yi, Taiwan","Huehuetenango, Guatemala",Medium-Light,56/74,NT $260/8 ounces,November 2024,9,9,9,8,9.0,,Guatemala Washed Huehuetenango Joya Verde,https://www.coffeereview.com/review/guatemala-washed-huehuetenango-joya-verde/,http://www.kakalovecafe.com.tw/,0,0,1,0,0,0
Ethiopia Washed Guji Uraga Tebe Burka,Kakalove Cafe,94,"Chia-Yi, Taiwan","Guji Zone, Oromia Region, southern Ethiopia",Medium-Light,58/80,NT $330/8 ounces,November 2024,9,9,9,8,,9.0,Ethiopia Washed Guji Uraga Tebe Burka,https://www.coffeereview.com/review/ethiopia-washed-guji-uraga-tebe-burka/,http://www.kakalovecafe.com.tw/,1,0,0,0,0,0
Colombia Decaf Granja Paraiso 92,Kakalove Cafe,93,"Chia-Yi, Taiwan","Piendamo, Cauca Department, Colombia",Medium-Light,57/78,NT $330/8 ounce,November 2024,9,9,9,8,,8.0,Colombia Decaf Granja Paraiso 92,https://www.coffeereview.com/review/colombia-decaf-granja-paraiso-92/,http://www.kakalovecafe.com.tw/,0,0,0,0,0,0
Ethiopia Natural Sidama ALO Village SKY Project FL,Kakalove Cafe,94,"Chia-Yi, Taiwan","Sidamo growing region, southern Ethiopia",Medium-Light,60/77,NT $490/4 ounces,November 2024,8,9,9,9,,9.0,Ethiopia Natural Sidama ALO Village SKY Project FL,https://www.coffeereview.com/review/ethiopia-natural-sidama-alo-village-sky-project-fl/,http://www.kakalovecafe.com.tw/,1,0,0,0,0,0
Taiwan Natural Alishan Chi Tsai Liu Li Ecological Farm,Kakalove Cafe,94,"Chia-Yi, Taiwan","Alishan, Taiwan",Medium-Light,60/77,"NT $1,100/4 ounces",November 2024,9,9,9,8,,9.0,Taiwan Natural Alishan Chi Tsai Liu Li Ecological Farm,https://www.coffeereview.com/review/taiwan-natural-alishan-chi-tsai-liu-li-ecological-farm/,http://www.kakalovecafe.com.tw/,0,0,0,0,1,0
Wilton Benitez SL28,JBC Coffee Roasters,96,"Madison, Wisconsin","Piendamo, Cauca Department, Colombia",Medium-Light,58/82,$33.00/8 ounces,November 2024,9,9,10,9,,9.0,Wilton Benitez SL28,https://www.coffeereview.com/review/wilton-benitez-sl28/,https://www.jbccoffeeroasters.com/product-category/coffee/,0,0,0,0,0,0
Kolla Bolcha #6 Ethiopia,JBC Coffee Roasters,94,"Madison, Wisconsin","Agaro, Oromia region, Ethiopia",Medium-Light,60/79,$20.00/12 ounces,November 2024,9,8,9,9,,9.0,Kolla Bolcha #6 Ethiopia,https://www.coffeereview.com/review/kolla-bolcha-6-ethiopia/,https://www.jbccoffeeroasters.com/product-category/coffee/,1,0,0,0,0,0
Bener Meriah Sumatra,JBC Coffee Roasters,94,"Madison, Wisconsin","Aceh, Sumatra, Indonesia",Medium-Light,59/77,$20.00/12 ounces,November 2024,9,9,9,8,,9.0,Bener Meriah Sumatra,https://www.coffeereview.com/review/bener-meriah-sumatra/,https://www.jbccoffeeroasters.com/product-category/coffee/,0,0,0,0,1,0
Ethiopia Yirgacheffe Hama Honey,Cozy House Coffee,95,"Taipei City, Taiwan","Yirgacheffe growing region, south-central Ethiopia",Medium-Light,59/81,NT $600/227 grams,November 2024,9,9,9,9,,9.0,Ethiopia Yirgacheffe Hama Honey,https://www.coffeereview.com/review/ethiopia-yirgacheffe-hama-honey/,https://shop.cozyhousecoffee.com/,1,0,0,0,0,0
Colombia Finca Santuario Red Bourbon Natural,Cozy House Coffee,95,"Taipei City, Taiwan","Cauca Department, Colombia",Light,62/94,NT $600/227 grams,November 2024,9,9,9,9,,9.0,Colombia Finca Santuario Red Bourbon Natural,https://www.coffeereview.com/review/colombia-finca-santuario-red-bourbon-natural/,https://shop.cozyhousecoffee.com/,0,0,0,0,0,0
Ethiopia Yirgacheffe Gutiti Gargari Natural,Cozy House Coffee,94,"Taipei City, Taiwan","Yirgacheffe growing region, south-central Ethiopia",Medium-Light,60/77,NT $450/227 grams,November 2024,9,9,9,8,,9.0,Ethiopia Yirgacheffe Gutiti Gargari Natural,https://www.coffeereview.com/review/ethiopia-yirgacheffe-gutiti-gargari-natural/,https://shop.cozyhousecoffee.com/,1,0,0,0,0,0
130 Blend,Jaunt Coffee Roasters,94,"San Diego, California",Guatemala; Ethiopia,Medium-Light,55/79,$19.00/12 ounces,November 2024,9,9,9,8,,9.0,130 Blend,https://www.coffeereview.com/review/130-blend/,https://jauntcoffee.com/,1,0,1,0,0,1
Fruits Melody,Coffeeland,94,"Chia-Yi, Taiwan",Ethiopia,Light,65/81,NT $390/227 grams,November 2024,9,9,9,8,,9.0,Fruits Melody,https://www.coffeereview.com/review/fruits-melody/,https://www.coffeeland.com.tw/,1,0,0,0,0,0
Matriarch,Jaunt Coffee Roasters,93,"San Diego, California",Brazil; Guatemala; Ethiopia,Medium-Light,56/74,$19.00/12 ounces,November 2024,9,9,9,8,,8.0,Matriarch,https://www.coffeereview.com/review/matriarch/,https://jauntcoffee.com/,1,0,1,0,0,1
Murphinator,Jaunt Coffee Roasters,92,"San Diego, California","Mexico, Papua New Guinea",Medium,47/65,$18.00/12 ounces,November 2024,8,9,9,8,,8.0,Murphinator,https://www.coffeereview.com/review/murphinator/,https://jauntcoffee.com/,0,0,1,0,1,0
Taiwan Symphony,Coffeeland,92,"Chia-Yi, Taiwan",Taiwan,Medium-Light,60/78,NT $1220/227 grams,November 2024,9,8,9,8,,8.0,Taiwan Symphony,https://www.coffeereview.com/review/taiwan-symphony/,https://www.coffeeland.com.tw/,0,0,0,0,1,0
Blue Notes,Coffeeland,91,"Chia-Yi, Taiwan",Guatemala; Colombia; Brazil; Myanmar,Medium-Light,58/76,NT $480/227 grams,November 2024,8,8,9,8,,8.0,Blue Notes,https://www.coffeereview.com/review/blue-notes/,https://www.coffeeland.com.tw/,0,0,1,0,1,1
Ethiopia Dale,Speedwell Coffee,93,"Plymouth, Massachusetts","Wensho Woreda, Sidamo growing region, Ethiopia",Light,62/80,$17.00/12 ounces,October 2024,9,8,9,8,,9.0,Ethiopia Dale,https://www.coffeereview.com/review/ethiopia-wale/,https://speedwellcoffee.com/,1,0,0,0,0,0
