title,roaster,score,Roaster Location,Coffee Origin,Roast Level,Agtron,Est. Price,Review Date,Aroma,Acidity/Structure,Body,Flavor,Aftertaste,With Milk,Acidity
Espresso No. 4,El Gran Cafe,91,"Antigua, Guatemala","Coban, Alta Verapaz, Guatemala",Medium-Light,52/70,$17.00/12 ounces,August 2023,8,,8,8,8,9,
Finca Rosario de Fátima,El Gran Cafe,91,"Antigua, Guatemala","Coban, Alta Verapaz, Guatemala",Medium-Light,58/74,$20.00/12 ounces,August 2023,9,8,8,9,7,,
Finca Retana Maracaturra,El Gran Cafe,91,"Antigua, Guatemala","Antigua, Guatemala",Medium-Light,58/78,$20.00/12 ounces,August 2023,9,8,8,9,7,,
Finca San José Ocaña,El Gran Cafe,88,"Antigua, Guatemala","Antigua, Guatemala",Medium-Light,56/72,$20.00/12 ounces,August 2023,8,7,8,8,7,,
El Potrero,El Gran Cafe,93,"Antigua, Guatemala","Alotenango, Sacatepequez, Guatemala",Medium-Light,60/74,$8.00/12 ounces,August 2023,9,9,8,9,8,,
Proyecto Aurora,El Gran Cafe,93,"Antigua, Guatemala","Sacatepequez, Guatemala",Medium-Light,60/78,$10.00/12 ounces,August 2023,9,9,8,9,8,,
Finca Santa Isabel,El Gran Cafe,93,"Antigua, Guatemala","San Cristobal Verapaz, Alta Verapaz, Guatemala",Medium-Light,57/74,$17.00/12 ounces,August 2023,9,9,8,9,8,,
Finca Patzibir,El Gran Cafe,92,"Antigua, Guatemala","San Lucas Tolimán, Lake Atitlán, Guatemala",Medium-Light,60/77,$20.00/12 ounces,August 2023,9,8,8,9,8,,
Finca La Esperanza Villa Sarchi,El Gran Cafe,90,"Antigua, Guatemala","Antigua, Guatemala",Medium-Light,57/80,$20.00/12 ounces,August 2023,8,8,8,8,8,,
Finca Las Moritas Pacamara,El Gran Cafe,92,"Antigua, Guatemala","El Progreso, Guatemala",Medium-Light,58/78,$17.00/12 ounces,August 2023,9,8,9,9,8,,
5a Sur,El Gran Cafe,92,"Antigua, Guatemala","Antigua, Guatemala",Medium-Light,57/74,$6.00/12 ounces,August 2023,9,8,8,9,8,,
5a Poniente,El Gran Cafe,89,"Antigua, Guatemala","Antigua, Guatemala",Medium-Light,56/72,$6.00/12 ounces,August 2023,8,8,8,8,7,,
Finca San Carlos,El Gran Cafe,88,"Antigua, Guatemala","Antigua, Guatemala",Medium-Light,55/71,$12.00/12 ounces,August 2023,8,7,8,8,7,,
Finca Las Moritas Caturra Amarillo,El Gran Cafe,85,"Antigua, Guatemala","El Progreso, Guatemala",Medium-Light,55/69,$17.00/12 ounces,August 2023,7,7,7,8,7,,
Wilton Benitez Sidra,JBC Coffee Roasters,94,"Madison, Wisconsin","Piendamó, Cauca Department, Colombia",Medium-Light,58/74,$22.00/8 ounces,August 2023,9,9,9,9,8,,
Twisted V.8 Espresso,JBC Coffee Roasters,93,"Madison, Wisconsin",South and Central America; Africa,Medium-Light,54/72,$18.00/12 ounces,August 2023,9,,8,9,8,9,
Piura Peru,JBC Coffee Roasters,92,"Madison, Wisconsin","El Faique, Piura Department, Peru",Medium-Light,56/74,$18.00/12 ounces,August 2023,8,8,9,9,8,,
Panama Hacienda La Esmeralda Geisha Natural,Euphora Coffee,95,"Taipei, Taiwan","Boquete growing region, western Panama",Medium-Light,60/77,$22.00/4 ounces,August 2023,9,9,9,10,8,,
Panama Hacienda La Esmeralda Geisha Washed,Euphora Coffee,95,"Taipei, Taiwan","Boquete growing region, western Panama",Light,64/78,$20.00/4 ounces,August 2023,9,9,9,9,9,,
Grand Champion Red Bourbon Natural,Rusty's Hawaiian,96,"Pahala, Hawaii","Ka'u growing district, Big Island of Hawai’i",Medium-Light,52/72,$35.00/4 ounces,August 2023,9,9,9,10,9,,
Panama Finca Don Julian Geisha Washed,GK Coffee,94,"Yilan, Taiwan","Boquete, Panama",Light,65/81,"NT $1,200/100 grams",August 2023,9,9,9,9,8,,
Guatemala Diamante Perez,Barrington Coffee Roasting Co.,93,"Lee, Massachusetts","Agua Dulce, Huehuetenango Department, Guatemala",Light,64/78,$19.45/12 ounces,August 2023,9,9,8,9,8,,
Taiwan Nantou Yuchi Kanon Estate SL34 Natural,Kakalove Cafe,93,"Chia-Yi, Taiwan","Nantou County, Taiwan",Medium-Light,58/74,NT $420/4 ounces,August 2023,9,8,9,9,8,,
Burundi Women of Turihamwe,Equator Coffees,92,"San Rafael, California","Ngozi Province, Burundi",Medium-Light,57/73,$20.00/12 ounces,August 2023,8,8,9,9,8,,
Colombia Finca La Roca,Jaunt Coffee Roasters,94,"San Diego, California","Planadas, Tolima Department, Colombia",Medium-Light,60/77,$26.00/12 ounces,August 2023,9,9,9,9,8,,
Colombia La Esperanza,Jaunt Coffee Roasters,93,"San Diego, California","Tolima Department, Colombia",Medium-Light,58/75,$23.00/12 ounces,August 2023,9,8,9,9,8,,
Promise of Spring,Bargain Cafe,94,"Taitung, Taiwan",Costa Rica; Ethiopia,Medium-Light,59/76,NT $450/200 grams,July 2023,9,9,9,9,8,,
Colombia Finca El Paraíso Geisha Sake,Paradise Roasters,96,"Hilo, Hawaii","Cauca, Colombia",Light,65/82,$60.00/4 ounces,July 2023,9,9,9,10,9,,
Tanzania Nyasi Furaha,Roadmap CoffeeWorks,94,"Lexington, Virginia","Mbeya, Ruvuma Region, Tanzania",Medium-Light,62/74,$19.00/12 ounces,July 2023,9,9,9,9,8,,
Kenya Gachatha AA Top,Kakalove Cafe,95,"Chia-Yi, Taiwan","Nyeri growing region, south-central Kenya",Medium-Light,58/74,NT $330/8 ounces,July 2023,9,9,9,9,9,,
Costa Rica Finca Mirella,Conscious Cup Coffee Roasters,93,"Crystal Lake, Illinois","Sabanilla de Alajuela, Central Valley, Costa Rica",Light,64/78,$27.00/12 ounces,July 2023,9,8,9,9,8,,
Kenya Nyeri Gatuya Factory AA Top,Buon Caffe,94,"Taipei, Taiwan","Nyeri growing region, south-central Kenya",Medium-Light,57/76,Nt $325/8 ounces,July 2023,9,9,9,9,8,,
Moonbow Decaf Espresso,Paradise Roasters,91,"Hilo, Hawaii",Colombia; Other South America,Medium-Light,51/73,$19.00/12 ounces,July 2023,8,,9,8,7,9,
Costa Rica Tarrazu Double Anaerobic Washed,Buon Caffe,94,"Taipei, Taiwan","Tarrazu growing region, Costa Rica",Medium-Light,60/77,NT $450/8 ounces,July 2023,9,9,9,9,8,,
Ethiopia Natural Bench Maji Lucy Station Gesha,Kakalove Cafe,93,"Chia-Yi, Taiwan","Bench Maji Zone, Southern Ethiopia",Medium-Light,58/75,NT $310/8 ounces,July 2023,9,9,8,9,8,,
Sumatra Pantan Musara,Conscious Cup Coffee Roasters,92,"Crystal Lake, Illinois","Pegasing, Takengon, Aceh Province, Sumatra, Indonesia",Medium-Light,58/75,#23.90/12 ounces,July 2023,8,8,9,9,8,,
Honduras Finca El Colibri,Conscious Cup Coffee Roasters,92,"Crystal Lake, Illinois","Marcala, La Paz Department, Honduras",Medium-Light,59/72,$20.00/12 ounces,July 2023,9,8,8,9,8,,
Ethiopia Sidamo Arbegona 74158 Natural,Buon Caffe,92,"Taipei, Taiwan","Sidamo growing region, south-central Ethiopia",Medium-Light,62/78,NT $325/8 ounces,July 2023,9,8,8,9,8,,
Ethiopia Sidama Bursa Kebele Washed,Buon Caffe,90,"Taipei, Taiwan","Arbegona Woreda, Bursa Kebele, Sidama Region, Ethiopia",Light,62/80,NT $325/8 ounces,July 2023,8,8,8,8,8,,
Brasil Ipanema Premier Cru BLUE A50 Red Anaerobic Natural,Buon Caffe,90,"Taipei, Taiwan","Serra da Mantiqueira-Fazenda Rio Verde, Sul De Minas, Brazil",Medium-Light,59/75,NT $325/8 ounces,July 2023,8,8,8,9,7,,
Wilton Benitez Pink Bourbon Colombia,JBC Coffee Roasters,98,"Madison, Wisconsin","Piendamo, Cauca Department, Colombia",Medium-Light,62/78,$20.00/8 ounces,July 2023,10,10,9,10,9,,
Costa Rica Las Lajas SL28 Natural,Magnolia Coffee,95,"Charlotte, North Carolina","Sabanilla de Alajuela, Central Valley, Costa Rica",Light,62/80,$30.00/12 ounces,July 2023,9,9,9,9,9,,
Nano Genji #12 Ethiopia,JBC Coffee Roasters,95,"Madison, Wisconsin","Agaro Gera, Jimma Zone, Oromia State, Ethiopia",Medium-Light,58/74,$23.00/12 ounces,July 2023,9,9,9,9,9,,
Costa Rica Aquiares Estate Dark-Roast,David's Nose,92,"Taipei, Taiwan","Aquiares, Cartago, Costa Rica",Medium,45/71,NT $500/8 ounces,July 2023,8,8,9,9,8,,
Gesha Spirits,Mostra Coffee,95,"San Diego, California","Huila Department, Colombia",Light,62/80,$48.00/10 ounces,July 2023,9,9,9,9,9,,
Philippine Rosemarie Rupecio,Mostra Coffee,92,"San Diego, California","Sitio Pluto, Balutakay, Managa, Davao del Sur, Philippines",Medium,53/65,$34.99/12 ounces,July 2023,9,8,8,9,8,,
Colombia Huila Charlotte Geisha Washed,Buon Caffe,94,"Taipei, Taiwan","Huila Department, Colombia",Light,65/79,NT $450/8 ounces,July 2023,9,9,9,9,8,,
Colombia Nariño Single-Origin Espresso,Temple Coffee,93,"Sacramento, California","Nariño Department, Colombia",Medium,52/68,$24.00/12 ounces,July 2023,9,,8,9,8,9,
Costa Rica Finca Sabana Redonda SL28,Torque Coffee,93,"San Diego, California","Poas Volcano, Alajuela Province, Costa Rica",Light,63/80,$32.00/boxed set (125 grams of this coffee plus 125 grams of an anaerobic-processed coffee from the same farm),July 2023,9,8,9,9,8,,
Panama Hacienda La Esmeralda Diamond Mountain Catuai Washed,Buon Caffe,93,"Taipei, Taiwan","Boquete growing region, western Panama",Medium-Light,60/77,NT $325/8 ounces,July 2023,9,9,8,9,8,,
Sunburst Cold Brew,JBC Coffee Roasters,93,"Madison, Wisconsin","Burundi, Colombia",Medium-Light,59/74,$19.00/12 ounces,July 2023,9,,8,9,8,9,
Yemen Al Kawlah Special Reserve Natural,RamsHead Coffee Roasters,95,"Livingston, Montana","Hayma Kharijiya growing region, Yemen",Medium-Light,60/77,$39.95/12 ounces,July 2023,9,9,9,9,9,,
Kona K7,Paradise Roasters,95,"Hilo, Big Island of Hawai'i","Holualoa, Kona, Big Island of Hawai’i",Light,63/79,$35.00/4 ounces,July 2023,9,9,9,9,9,,
Ecuador La Josefina Estate,Magnolia Coffee,94,"Charlotte, North Carolina","El Chaco Canton, Parroquia Santa Rosa, Napo Province, Ecuador",Light,62/84,$25.00/12 ounces,July 2023,9,9,9,9,8,,
Ethiopia Kafa Natural,Jaunt Coffee Roasters,94,"San Diego, California","Bonga Forest, Keficho-Shekicho Zone, southwest Ethiopia",Light,65/79,$23.00/12 ounces,July 2023,9,9,9,9,8,,
El Salvador Bourbon Semi-Washed,RamsHead Coffee Roasters,94,"Livingston, Montana","Cordillera de Llamatepec, El Salvador",Medium-Light,58/72,$17.50/12 ounces,July 2023,9,9,9,9,8,,
Peru Lucmabamba,Temple Coffee,93,"Sacramento, California","Cusco region, Peru",Medium-Light,57/73,$23.00/12 ounces,July 2023,9,8,9,9,8,,
Sumatra Gayo Lues Natural,Magnolia Coffee,93,"Charlotte, North Carolina","Aceh Province, Sumatra, Indonesia",Medium-Light,60/74,$23.00/12 ounces,July 2023,9,9,8,9,8,,
Burundi Turihamwe,Temple Coffee,93,"Sacramento, California","Ngozi Province, Burundi",Light,62/80,$24.00/12 ounces,July 2023,9,8,9,9,8,,
Kenya Nyeri Rukira,Jaunt Coffee Roasters,93,"San Diego, California","Nyeri County, central Kenya",Medium-Light,62/76,$24.00/12 ounces,July 2023,9,9,8,9,8,,
Bale Mountain Natural Ethiopia,JBC Coffee Roasters,94,"Madison, Wisconsin","Werka, Guji Zone, Oromia Region, southern Ethiopia",Light,64/80,$23.00/12 ounces,June 2023,9,9,9,9,8,,
Cumba #3 Burundi,JBC Coffee Roasters,93,"Madison, Wisconsin","Tangara, Ngozi Province, Burundi",Medium-Light,61/77,$21.00/12 ounces,June 2023,9,9,8,9,8,,
Leles Garut Java,JBC Coffee Roasters,92,"Madison, Wisconsin","Cijapati, Garut Regency, West Java, Indonesia",Medium-Light,58/74,$18.00/12 ounces,June 2023,9,8,8,9,8,,
La Papaya Ecuador Geisha Natural,JBC Coffee Roasters,96,"Madison, Wisconsin","Saraguro, Loja growing region, Ecuador",Medium-Light,59/75,$29.00/12 ounces,June 2023,9,9,9,10,9,,
Espresso Classico,Paradise Roasters,93,"Hilo, Big Island of Hawai’i",Brazil; Thailand; Nicaragua; Ecuador,Medium,52/64,$19.00/12 ounces,June 2023,9,,8,9,8,9,
Colombia Tolima Finca El Vergel Rebel Geisha,Bargain Cafe,95,"Taitung, Taiwan","Tolima, Colombia",Light,63/81,NT $550/200 grams,June 2023,9,9,9,9,9,,
Encounter of Summer,Bargain Cafe,94,"Taitung, Taiwan",Costa Rica; Ethiopia,Light,62/80,NT $450/200 grams,June 2023,9,9,9,9,8,,
SL34 Dark Roast,Hula Daddy Kona Coffee,94,"Holualoa, Hawai’i","Holualoa, North Kona growing district, “Big Island” of Hawai’i",Medium-Dark,48/52,$69.95/8 ounces,June 2023,9,9,8,9,9,,
Ethiopia Bench Maji Geisha Lucy Station Dark Roast,GK Coffee,94,"Yilan, Taiwan","Bench Maji Zone, Southern Ethiopia",Medium-Dark,45/52,NT $600/200 grams,June 2023,9,9,9,9,8,,
Kenya AB Athena Plus,Simon Hsieh Aroma Roast Coffees,94,"Taiyuan, Taiwan","Nyeri growing region, south-central Kenya",Dark,33/44,NT $800/8 ounces,June 2023,9,9,9,9,8,,
Sumatra Karo Mandheling – ‘lil darker,Revel Coffee,91,"Billings, Montana","Paranginan, Humbahas Province, Karo Highlands, Sumatra, Indonesia",Medium,52/61,$21.25/12 ounces,June 2023,8,8,8,9,8,,
Ethiopia Yirgacheffe Yeast Process,Revel Coffee,93,"Billings, Montana","Wenago Woreda, Gedeo Zone, SNNP, southern Ethiopia",Medium-Light,59/74,$21.50/12 ounces,June 2023,9,9,8,9,8,,
Peru Maria Nieves,Roadmap CoffeeWorks,93,"Lexington, Virginia","La Coipa, San Ignacio, Cajamarca, Peru",Medium-Light,54/73,$23.50/12 ounces,June 2023,9,8,9,9,8,,
Kenya Kagumo AB,Revel Coffee,93,"Billings, Montana","Nyeri growing region, south-central Kenya",Medium-Light,58/75,$24.25/12 ounces,June 2023,9,9,8,9,8,,
West Papua Wamena,Roadmap CoffeeWorks,93,"Lexington, Virginia","Wamena growing region, West Papua, New Guinea",Medium-Light,58/74,$17.00/12 ounces,June 2023,9,8,9,9,8,,
Costa Rica Turrialba Volcano Honey Process,Buon Caffe,94,"Taipei, Taiwan","Turrialba, Costa Rica",Medium-Light,59/77,NT $325/8 ounces,June 2023,9,9,9,9,8,,
Ethiopia Yirgacheffe Adame Washed Process,Buon Caffe,93,"Taipei, Taiwan","Yirgacheffe growing region, south-central Ethiopia",Medium-Light,60/74,NT $300/8 ounces,June 2023,9,9,8,9,8,,
Ethiopia Washed Yirgacheffe Gedeb Worka Chelchele,Kakalove Café,93,"Chia-Yi, Taiwan","Gedeo Zone, SNNPR, southern Ethiopia",Light,65/81,NT $275/8 ounces,June 2023,9,9,8,9,8,,
Ethiopia Bench-Maji Lucy Station Geisha,Bargain Cafe,93,"Taitung, Taiwan","Bench-Maji Zone, Southern Ethiopia",Medium-Light,62/75,NT $399/200 grams,May 2023,9,9,8,9,8,,
Ethiopia Washed Aricha Woreda Yirgacheffe,Ramshead Coffee Roasters,92,"Bozeman, Montana","Yirgacheffe growing region, southern Ethiopia",Medium-Light,58/78,$19.00/12 ounces,May 2023,9,8,9,9,7,,
Colombia Huila Finca El Triunfo Martha Zuñiga Pink Bourbon,Ramshead Coffee Roasters,94,"Bozeman, Montana","Tolimas, Colombia",Medium-Light,58/74,$32.00/12 ounces,May 2023,9,9,9,9,8,,
Costa Rica SL28 Natural,Coffeeland,93,"Chia-Yi, Taiwan","Tarrazu growing region, Costa Rica",Medium-Light,56/72,NT $750/227 grams,May 2023,9,8,9,9,8,,
Sunrise Blend,Heat Coffee,90,"Taipei, Taiwan",Ethiopia; Brazil; India; Indonesia; Guatemala,Medium-Light,57/71,NT $130/8 ounces,May 2023,8,8,8,9,7,,
Bella Carmona Guatemala,JBC Coffee Roasters,93,"Madison, Wisconsin","Sacatepequez, Antigua growing region, Guatemala",Medium-Light,58/76,$19.00/12 ounces,May 2023,9,8,9,9,8,,
Huye Mountain Rwanda,JBC Coffee Roasters,93,"Madison, Wisconsin","Huye District, Rwanda",Medium-Light,59/75,$19.00/12 ounces,May 2023,9,8,9,9,8,,
Ethiopia Bench Maji Geisha Lucy Station,GK Coffee,94,"Yilan, Taiwan","Bench-Maji Zone, Southern Ethiopia",Light,64/83,NT $600/200 grams,May 2023,9,9,9,9,8,,
Ecuador Peñaherrera AAA,PT's Coffee Roasting Co.,95,"Topeka, Kansas","Imbabura Province, Ecuador",Medium-Light,60/77,$25.00/12 ounces,May 2023,9,9,9,9,9,,
West Java Frinsa Estate Natural,Corvus Coffee,93,"Denver, Colorado","Bandung Highlands, West Java, Indonesia",NA,/,$23.00/12 ounces,May 2023,9,8,9,9,8,,
Java Argopuro Mountain Anaerobic Natural,Equator Coffees,93,"San Rafael, California","Tlogosari Village, Argopuro, East Java, Indonesia",NA,/,$20.00/12 ounces,May 2023,9,9,8,9,8,,
La Papaya Natural Ecuador,JBC Coffee Roasters,95,"Madison, Wisconsin","Saraguro, Loja, Ecuador",Medium-Light,58/80,$19.00/8 ounces,May 2023,9,9,9,9,9,,
Wilton Benitez Tabi VIP Colombia,JBC Coffee Roasters,95,"Madison, Wisconsin","Piendamó, Cauca Department, Colombia",Light,64/86,$22.00/12 ounces,May 2023,9,9,9,9,9,,
El Mango Peru,JBC Coffee Roasters,94,"Madison, Wisconsin","San Ignacio, Cajamarca, Peru",Medium-Light,56/77,$19.00/12 ounces,May 2023,9,9,9,9,8,,
Banko Gotiti Ethiopia,JBC Coffee Roasters,95,"Madison, Wisconsin","Gedeb District, Gedeo Zone, southern Ethiopia",Medium-Light,60/78,$20.00/12 ounces,May 2023,9,9,8,10,9,,
El Morito Guatemala,JBC Coffee Roasters,94,"Madison, Wisconsin","Mataquescuintla, Jalapa, Guatemala",Medium-Light,59/76,$19.00/8 ounces,May 2023,9,9,9,9,8,,
Gera DR Congo,JBC Coffee Roasters,93,"Madison, Wisconsin","South Kivu Province, Democratic Republic of the Congo",Medium-Light,60/78,$20.00/12 ounces,May 2023,9,8,9,9,8,,
Pantan Musara Sumatra,JBC Coffee Roasters,95,"Madison, Wisconsin","Pegasing, Takengon, Aceh Province, Sumatra, Indonesia",Medium-Light,56/78,$23.00/12 ounces,May 2023,9,9,9,9,9,,
Giakanja Kenya,JBC Coffee Roasters,94,"Madison, Wisconsin","Nyeri County, Kenya",Medium-Light,59/79,$25.00/12 ounces,May 2023,9,9,8,9,9,,
Asobombo Colombia,JBC Coffee Roasters,93,"Madison, Wisconsin","Pitalito, Huila Department, Colombia",Medium-Light,58/76,$20.00/12 ounces,May 2023,9,9,8,9,8,,
Ethiopia Basha Bekele,Roadmap CoffeeWorks,95,"Lexington, Virginia","Sidamo growing region, south-central Ethiopia",Light,62/86,$23.00/12 ounces,April 2023,9,9,9,9,9,,
Colombia Luz Helena Salazar Wine Yeast Grape Honey,GK Coffee,94,"Yilan, Taiwan","Quindio Department, Colombia",Medium-Light,58/80,NT $700/200 grams,April 2023,9,9,9,9,8,,
Ka‘ū Malolactic Natural,Paradise Roasters,94,"Hilo, Big Island of Hawai’i","Ka‘ū growing region, Big Island of Hawai’i",Medium-Light,62/76,$40.00/4 ounces,April 2023,9,8,9,9,9,,
Jade Rabbit Espresso Blend,Simon Hsieh Aroma Roast Coffees,95,"Taoyuan, Taiwan",Ethiopia; Kenya,Medium,46/70,NT $650/8 ounces,April 2023,9,,9,9,9,9,
Passion Paradise,Hutu Cafe Roastery,93,"Taipei, Taiwan",Colombia; Kenya; El Salvador,Medium-Light,60/78,NT $500/200 grams,April 2023,9,9,8,9,8,,
Autumn Forest,Hutu Cafe Roastery,93,"Taipei, Taiwan",Colombia; Kenya; Costa Rica,Medium-Light,61/79,NT $500/200 grams,April 2023,9,9,8,9,8,,
Colombia Geisha Spirits Brew Bag,Mostra Coffee,92,"San Diego, California","Huila Department, Colombia",NA,0/0,$34.00/5 single-serve brew bags,April 2023,8,8,9,9,8,,
Ethiopia Washed Brew Bag,Kakalove Cafe,91,"Chia-Yi, Taiwan",Ethiopia,NA,0/0,NT $30/1 single-serve brew bag,April 2023,8,8,8,9,8,,
Bull Demon King Brew Bag,Simon Hsieh Aroma Roast Coffees,91,"Taoyuan, Taiwan",Colombia; Peru; Rwanda; Ethiopia,NA,0/0,NT $500/5 single-serve brew bags,April 2023,8,8,8,9,8,,
Road Less Traveled Brew Bag,Roadmap CoffeeWorks,90,"Lexington, Virginia",Colombia; Peru; Rwanda; Ethiopia,NA,0/0,$4.50/4 single-serve brew bags,April 2023,8,8,8,8,8,,
Ethiopia Natural Brew Bag,Euphora Coffee,89,"Taipei, Taiwan",Ethiopia,NA,0/0,$10.00/10 single-serve brew bags,April 2023,8,8,8,8,7,,
Ethiopia Halo Beriti Single-Origin Espresso,Temple Coffee,95,"Sacramento, California","Yirgacheffe growing region, south-central Ethiopia",Medium-Light,56/74,$24.00/12 ounces,April 2023,9,,9,9,9,9,
Ethiopia Gora Kone,Temple Coffee,94,"Sacramento, California","Sidamo growing region, southern Ethiopia",Light,62/84,$23.50/12 ounces,April 2023,9,9,9,9,8,,
Easter Sunrise Blend,Mystic Monk Coffee,93,"Clark, Wyoming",Not disclosed,Medium-Light,56/74,$15.99/12 ounces,April 2023,9,8,9,9,8,,
Ecuador Pichincha Imbabura Chirmoya,Mystic Monk Coffee,93,"Clary, Wyoming","Pichincha Province, Ecuador",Medium-Light,58/80,$15.95/12 ounces,April 2023,9,9,8,9,8,,
Wonderblend,Temple Coffee,93,"Sacramento, California",Costa Rica; Ethiopia,Medium-Light,59/77,$25.00/12 ounces,April 2023,9,9,8,9,8,,
Ecuador Finca Lugmapata,Equator Coffees,94,"San Rafael, California","Pallatanga, Chimborazo Province, Ecuador",Medium-Light,62/79,$22.00/6 ounces,April 2023,9,9,9,9,8,,
Mocha Java Blend,Equator Coffees,93,"San Rafael, California",Ethiopia; Sumatra,Medium-Light,59/77,$17.50/12 ounces,April 2023,9,8,9,9,8,,
Quindio Gold Honey Colombia,JBC Coffee Roasters,94,"Madison, Wisconsin","Circasia Municipality, Quindio Department, Colombia",Light,62/80,$18.00/8 ounces,April 2023,9,9,9,9,8,,
Kenya Washed Kiambu Gititu AB Top,Kakalove Cafe,95,"Chia-Yi, Taiwan","Kiambu growing region, south-central Kenya",Light,60/82,NT $300/8 ounces,March 2023,9,9,9,9,9,,
Ethiopia Natural Guji Dasaya,Kakalove Cafe,95,"Chia-Yi, Taiwan","Guji Zone, Oromia Region, southern Ethiopia",Light,62/86,NT $290/8 ounces,March 2023,9,9,9,9,9,,
Kona Classic,Paradise Roasters,94,"Hilo, Hawaii","Kona growing region, Big Island of Hawai’i",Medium-Light,60/78,$25.00/4 ounces,March 2023,9,9,9,9,8,,
Hawai’i Ka‘ū Champagne Natural,Paradise Roasters,94,"Hilo, Hawaii","Ka‘ū growing region, Big Island of Hawai’i",Medium-Light,60/78,$25.00/4 ounces,March 2023,9,9,9,9,8,,
Ethiopia Sidamo Rumudamo Premium,Kakalove Cafe,95,"Chia-Yi, Taiwan","Sidamo growing region, southern Ethiopia",Light,64/84,NT $400/8 ounces,March 2023,9,9,9,9,9,,
Yemen Natural Hamoud Abdullah AL-Khisheni,Kakalove Cafe,94,"Chia-Yi, Taiwan","Al Hayma, Sana'a Governorate, Yemen",Light,62/80,NT $600/4 ounces,March 2023,9,9,9,9,8,,
Ethiopia Guji,Heat Coffee,94,"Taipei, Taiwan","Guji Zone, Oromia Region, southern Ethiopia",Light,65/86,NT $180/8 ounces,March 2023,9,9,8,9,9,,
Ecuador Legrand Robusta Lactic Natural Espresso,Paradise Roasters,92,"Hilo, Hawaii","Santa Elena Province, Ecuador",Medium-Light,57/74,$19.00/12 ounces,March 2023,9,,8,9,7,9,
Worka Sakaro Ethiopia,JBC Coffee Roasters,95,"Madison, Wisconsin","Worka Sakaro, Gedeb District, Gedeo Zone, Ethiopia",Light,62/84,$20.00/12 ounces,March 2023,9,9,9,9,9,,
Teremuka Peaberry Kenya,JBC Coffee Roasters,94,"Madison, Wisconsin","Nakuru County, Kenya",Medium-Light,60/77,$24.00/12 ounces,March 2023,9,9,9,9,8,,
Teremuka Kenya,JBC Coffee Roasters,94,"Madison, Wisconsin","Nakuru County, Kenya",Medium-Light,60/77,$24.00/12 ounces,March 2023,9,9,9,9,8,,
La Joya Ecuador,JBC Coffee Roasters,93,"Madison, Wisconsin","Gonzanama, Loja Province, Ecuador",Light,61/83,$25.00/12 ounces,March 2023,9,9,8,9,8,,
Norte Peru,JBC Coffee Roasters,93,"Madison, Wisconsin","Jaén Province, Cajamarca Region, Peru",Medium-Light,58/78,$18.00/12 ounces,March 2023,9,8,9,9,8,,
San Jose del Lago Guatemala,JBC Coffee Roasters,93,"Madison, Wisconsin","Santiago Atitlán, Sololá Department, Guatemala",Medium-Light,59/77,$22.00/12 ounces,March 2023,9,9,8,9,8,,
Ethiopia Keramo Natural,Rusty Dog Coffee,93,"Madison, Wisconsin","Sidamo growing region, Ethiopia",Light,64/86,$20.50/12 ounces,March 2023,9,8,9,9,8,,
Peru Cajamarca,Rusty Dog Coffee,92,"Madison, Wisconsin","Cajamarca, Peru",Medium-Light,58/76,$15.25/12 ounces,March 2023,9,8,8,9,8,,
El Salvador La Muela Pacamara,PT's Coffee Roasting Co.,94,"Topeka, Kansas","Chalatenango, El Salvador",Medium-Light,58/77,$23.00/12 ounces,March 2023,9,9,9,9,8,,
Colombia Finca Juan Martin Aced Sidra,Revel Coffee,95,"Billings, Montana","Cauca, Colombia",Light,62/80,$31.50/12 ounces,March 2023,9,9,9,9,9,,
Guatemala Natural Santa Felisa Gesha SF-04 95,Kakalove Cafe,95,"Chia-Yi, Taiwan","Acatenango, Chimaltenango Department, Guatemala",Medium-Light,59/75,NT $650/4 ounces,March 2023,9,9,9,9,9,,
Colombia Red Bomb,Roadmap CoffeeWorks,94,"Lexington, Virginia","La Sierra, Medellin, Colombia",Medium-Light,59/77,$25.00/12 ounces,March 2023,9,9,9,9,8,,
Ethiopia 2022 COE #3 Washed Temam 74110,Kakalove Cafe,95,"Chia-Yi, Taiwan","Jimma Zone, Oromia region, southern Ethiopia",Light,62/86,"NT $1,250/4 ounces",March 2023,9,9,9,9,9,,
Espresso Giusto,Roadmap CoffeeWorks,94,"Lexington, Virginia",Colombia; Guatemala; Mexico,Medium-Light,54/72,$16.95/12 ounces,March 2023,9,,9,9,8,9,
Ethiopia Guji Shakiso Mulish Washed,Buon Caffe,93,"Taipei, Taiwan","Odo Shakiso District, Guji Zone, southern Ethiopia",Light,65/83,NT $320/8 ounces,March 2023,9,9,8,9,8,,
Golden Parrot Blend Espresso,Kakalove Cafe,94,"Chia-Yi, Taiwan",Guatemala; Ethiopia; Colombia,Medium-Light,58/78,NT $210/8 ounces,March 2023,9,,9,9,8,9,
French Roast,Roadmap CoffeeWorks,92,"Lexington, Virginia",Guatemala; Mexico,Medium,46/62,$17.95/12 ounces,March 2023,9,8,8,9,8,,
Spring Loop Espresso Blend,Buon Caffe,92,"Taipei, Taiwan",Colombia; El Salvador,Medium-Light,58/77,NT $350/8 ounces,March 2023,8,,9,9,8,8,
Amber Forest Espresso Blend,Buon Caffe,90,"Taipei, Taiwan",Ethiopia; Colombia; Sumatra,Medium-Light,57/75,NT $240/8 ounces,March 2023,8,,8,8,8,8,
Galaxy Gesha Quindio Colombia Edwin Noreña,Barrington Coffee Roasting Co.,95,"Lee, Massachusetts","Circasia, Quindio Department, Colombia",Light,65/86,$38.45/12 ounces,March 2023,9,9,9,9,9,,
Ka‘ū JN Farms Malolactic Honey,Paradise Roasters,95,"Hilo, Big Island of Hawai’i","Ka‘ū growing region, Big Island of Hawai’i",Light,62/84,$40.00/4 ounces,March 2023,9,9,9,9,9,,
Colombia Finca El Paraiso Rose Tea,GK Coffee,94,"Yilan, Taiwan","Cauca Department, Colombia",Light,64/88,NT $500/100 grams,March 2023,9,9,9,9,8,,
Colombia Monteblanco Rodrigo Sanchez Carbonic Maceration,Klatch Coffee,94,"Los Angeles, California","Huila Department, Colombia",Light,56/86,$23.95/310 grams,March 2023,9,9,9,9,8,,
Colombia Granja Paraíso-92- Papayo Kōji,Paradise Roasters,95,"Hilo, Hawaii","Piendamó, Cauca Department, Colombia",Light,64/84,$40.00/4 ounces,March 2023,9,9,9,9,9,,
Costa Rica Aquiares Estate,David's Nose,93,"Taipei, Taiwan","Aquíares, Cartago, Costa Rica",Light,65/87,NT $500/8 ounces,March 2023,9,8,9,9,8,,
Kenya Kiambu Mandela Estate AA Washed Process,Buon Caffe,94,"Taipei, Taiwan","Kiambu County, south-central Kenya",Medium-Light,60/77,NT $349/8 ounces,March 2023,9,9,9,9,8,,
Ethiopia Yirgacheffe Konga Washed Process,Buon Caffe,93,"Taipei, Taiwan","Yirgacheffe growing region, southern Ethiopia",Light,62/81,NT $349/8 ounces,March 2023,9,9,8,9,8,,
Ethiopia Guji Bule Hora Blue Nile Natural,Buon Caffe,90,"Taipei, Taiwan","Odo Shakiso District, Guji Zone, southern Ethiopia",Medium-Light,54/84,NT $369/8 ounces,March 2023,8,8,8,8,8,,
Kenya Gichathaini,Temple Coffee,94,"Sacramento, California","Mathira West District, Nyeri growing region, Kenya",Light,64/82,$25.00/12 ounces,February 2023,9,9,9,9,8,,
Guatemala Retiro del Quisaya Natural Process,Durango Coffee Company,94,"Durango, Colorado","San Martin Jilotepeque, Chimaltenango Department, Guatemala",Medium-Light,59/78,$18.95/12 ounces,February 2023,9,9,9,9,8,,
Ethiopia Sidama Karamo Anaerobic Natural,RamsHead Coffee Roasters,94,"Bozeman, Montana","Sidamo growing region, south-central Ethiopia.",Medium-Light,62/79,$35.00/12 ounces,February 2023,9,9,9,9,8,,
Colombia Geiner Montano,Temple Coffee,94,"Sacramento, California","Huila Department, Colombia",Medium-Light,62/78,$24.50/12 ounces,February 2023,9,9,9,9,8,,
