title,roaster,score,Roaster Location,Coffee Origin,Roast Level,Agtron,Est. Price,Review Date,Aroma,Acidity/Structure,Body,Flavor,Aftertaste,With Milk,Acidity
Ethiopia Natural Sidama TAMIRU 74158,Kakalove Cafe,96,"Chia-Yi, Taiwan","Sidama growing region, southern Ethiopia",Medium-Light,60/78,NT $400/4 ounces,January 2022,9,9,9,10,9,,
Uganda Organic Sipi Falls Honey,Jackrabbit Java,93,"Thermopolis, Wyoming","Sipi Falls, Bugisu Region, Uganda",Medium-Light,56/74,$18.00/12 ounces,January 2022,9,8,9,9,8,,
Bedhatu Jibicho Natural,JBC Coffee Roasters,95,"Madison, Wisconsin","Gedeb District, Gedeo Zone, southern",Medium-Light,60/76,$20.00/12 ounces,January 2022,9,9,9,9,9,,
Ethiopia Natural Guji DoReMi,Kakalove Cafe,95,"Chia-Yi, Taiwan","Guji Zone, Oromia Region, southern Ethiopia",Medium-Light,57/77,NT $210/8 ounces,January 2022,9,,9,9,9,9,
Sabana Redonda SL28 Costa Rica,JBC Coffee Roasters,94,"Madison, Wisconsin","Sabanilla de Alajuela, Central Valley, Costa Rica",Medium-Light,58/80,$18.00/8 ounces,January 2022,9,9,9,9,8,,
Gigesa Ethiopia,JBC Coffee Roasters,93,"Madison, Wisconsin","Guji Zone, Oromia Region, Ethiopia",Medium-Light,57/75,$19.00/12 ounces,January 2022,8,9,9,9,8,,
Ka’u Peaberry Hawai’i,Jackrabbit Java,92,"Thermopolis, Wyoming","Ka’u growing region, Big Island of Hawai’i",Medium-Light,58/78,$38.50/12 ounces,January 2022,9,8,8,9,8,,
Sumatra Siamang Forest,Paradise Roasters,94,"Minneapolis, Minnesota","Simalungun, Sumatra, Indonesia",Medium-Light,54/72,$25.00/12 ounces,January 2022,9,9,9,9,8,,
Yemen Jabal Nabi Special Reserve,RamsHead Coffee Roasters,94,"Bozeman, Montana","Hayma Dakhiliya growing region, Sana’a Governorate, Yemen",Medium-Light,57/73,$13.95/4 ounces,January 2022,9,9,9,9,8,,
Kenya Gakuyuini AA,RamsHead Coffee Roasters,94,"Bozeman, Montana","Kirinyaga County, south-central Kenya",Medium-Light,58/76,$16.95/12 ounces,January 2022,9,9,8,9,9,,
Colombia Manos Juntas,Conscious Cup Coffee Roasters,92,"Crystal Lake, Illinois","Cauca, Colombia",Medium-Light,60/77,$29.00/12 ounces,January 2022,9,8,8,9,8,,
Ethiopia Guji Goro Bedessa,Conscious Cup Coffee Roasters,93,"Crystal Lake, Illinois","Guji Zone, Ethiopia",Medium-Light,60/77,$24.00/12 ounces,January 2022,9,9,8,9,8,,
Ethiopia Guji Hambela G1 Kudume Wolicho Honey,GK Coffee,93,"Yilan, Taiwan","Sidama growing region, southern Ethiopia",Light,62/80,NT $650/200 grams,January 2022,9,9,8,9,8,,
Gelena Geisha,Corvus Coffee Roasters,94,"Denver, Colorado","Guji Zone, Oromia region, southern Ethiopia",Medium-Light,60/78,$19.00/12 ounces,January 2022,9,8,9,9,9,,
Silver Monk Seasonal Blend,Corvus Coffee Roasters,92,"Denver, Colorado","Guji Zone, Oromia region, southern Ethiopia",Medium-Light,59/75,$19.00/12 ounces,January 2022,9,8,8,9,8,,
Ethiopia Tamiru Tadesse Tesema Anaerobic Natural,GK Coffee,95,"Yilan, Taiwan","Sidama growing region, southern Ethiopia",Medium-Light,62/78,NA (available in store only),January 2022,9,9,9,9,9,,
Ethiopia Guji Washed G1 Uncle Select Lot 21/01,GK Coffee,93,"Yilan, Taiwan","Guji Zone, Oromia region, southern Ethiopia",Medium-Light,58/74,NT $550/200 grams,January 2022,9,9,8,9,8,,
Ethiopia Aphrodite Washed Espresso,Simon Hsieh Aroma Roast Coffees,96,"Taoyuan, Taiwan","Yirgacheffe growing region, south-central Ethiopia",Medium,44/60,NT $850/8 ounces,January 2022,9,,9,9,10,9,
Kona Tropical Punch Washed,Paradise Roasters,94,"Minneapolis, Minnesota","Kona, Big Island of Hawai’i",Medium-Light,60/76,$25.00/4 ounces,January 2022,9,9,9,9,8,,
Gatomboya Kenya,JBC Coffee Roasters,93,"Madison, Wisconsin","Nyeri County, Kenya",Medium-Light,56/78,$22.00/12 ounces,January 2022,9,8,9,9,8,,
Ka’u Bourbon Champagne Natural,Paradise Roasters,94,"Minneapolis, Minnesota","Ka’u growing region, Big Island of Hawai’i",Medium-Light,58/76,$30.00/4 ounces,January 2022,9,9,9,9,8,,
Cerro Azul Geisha,JBC Coffee Roasters,95,"Madison, Wisconsin","Trujillo, Valle del Cauca, Colombia",Medium-Light,58/80,$30.00/8 ounces,December 2021,9,9,9,9,9,,
Panama Mama Cata Geisha Champagne Natural,Paradise Roasters,95,"Minneapolis, Minnesota","Boquete growing region, Panama",Light,64/88,$50.00/4 ounces,December 2021,9,9,9,9,9,,
Ethiopia Yirgacheffe Worka Sakaro,Paradise Roasters,95,"Minneapolis, Minnesota","Gedeb District, Gedeo Zone, southern Ethiopia",Medium-Light,57/79,$25.00/12 ounces,December 2021,9,9,9,9,9,,
Haraaz Red,JBC Coffee Roasters,93,"Madison, Wisconsin","Al Mashtal ul Burhani, Yemen",Medium-Light,56/74,$20.00/8 ounces,December 2021,9,8,9,9,8,,
Guatemala Acatenango Gesha,Jaunt Coffee Roasters,94,"San Diego, California","Acatenango, Guatemala",Light,62/80,$24.00/8 ounces,December 2021,9,9,9,9,8,,
Costa Rica Luis Campos Termico,Revel Coffee,93,"Billings, Montana","Tarrazu, Costa Rica",Medium-Light,58/78,$26.00/12 ounces,December 2021,9,8,9,9,8,,
Espresso No. 2,El Gran Cafe,91,"Antigua, Guatemala","Alotenango, Antigua, Guatemala",Medium-Light,56/77,$13.00/12 ounces,December 2021,8,,8,8,8,9,
Finca Huixoc Maracaturra,El Gran Cafe,90,"Antigua, Guatemala","Huehuetenango Department, Guatemala",Medium-Light,58/73,$13.00/12 ounces,December 2021,8,8,8,8,8,,
Finca Santa Isabel,El Gran Cafe,90,"Antigua, Guatemala","Cobán, Alta Verapaz Department, Guatemala",Light,63/80,$13.00/12 ounces,December 2021,8,8,8,8,8,,
Proyecto Aurora,El Gran Cafe,92,"Antigua, Guatemala","Antigua, Guatemala",Medium-Light,56/68,$10.00/12 ounces,December 2021,9,8,8,9,8,,
Las Moritas Yellow Caturra,El Gran Cafe,87,"Antigua, Guatemala","El Progresso Department, Guatemala",Light,58/84,$13.00/12 ounces,December 2021,8,7,7,8,7,,
El Pintado Classico,El Gran Cafe,87,"Antigua, Guatemala","Antigua, Guatemala",Light,65/79,$16.50/12 ounces,December 2021,8,7,7,8,7,,
5a Poniente,El Gran Cafe,88,"Antigua, Guatemala","Antigua, Guatemala",Medium,48/56,$5.00/12 ounces,December 2021,8,7,8,8,7,,
Esperanza Villa Sarchi,El Gran Cafe,90,"Antigua, Guatemala","Antigua, Guatemala",Light,66/84,$16.50/12 ounces,December 2021,8,8,8,8,8,,
Esperanza Bourbon,El Gran Cafe,92,"Antigua, Guatemala","Antigua, Guatemala",Medium-Light,59/76,$16.50/12 ounces,December 2021,8,9,8,9,8,,
Finca San Carlos,El Gran Cafe,88,"Antigua, Guatemala","Antigua, Guatemala",Light,63/83,$13.00/12 ounces,December 2021,8,7,7,8,7,,
Costa Rica Volcan Azul San Isidro Red Honey,PT’s Coffee Roasting Co.,95,"Topeka, Kansas","Poás Volcano region, Alajuela Province, Costa Rica",Medium-Light,58/76,$22.00/12 ounces,December 2021,9,9,9,9,9,,
Ethiopia Washed Sidama Bensa Bombe,Kakalove Cafe,94,"Chiya-Yi, Taiwan","Sidama Region, Ethiopia",Light,60/82,NT $375/8 ounces,December 2021,9,9,9,9,8,,
Panama Abu Geisha Lot 6,Willoughby's Coffee & Tea,95,Branford Connecticut,"Cañas Verdes, Boquete growing region, Panama",Medium-Light,58/80,$75.00/12 ounces,December 2021,9,9,9,9,9,,
Panama Finca Mi Finquita Geisha Afrodita Natural,Kakalove Cafe,96,"Chiya-Yi, Taiwan","Tierras Altas, Chiriquí Province, Panama",Medium-Light,59/81,NT $1250/4 ounces,December 2021,9,9,9,10,9,,
Panama El Burro Estate Natural Gesha,Kakalove Cafe,95,"Chiya-Yi, Taiwan","Potrerillo Arriba, Boquete, Panama",Medium-Light,58/77,"NT $1,400/4 ounces",December 2021,9,9,9,9,9,,
Panama La Viuda Natural Geisha 4 Hermanos,Kakalove Cafe,94,"Chiya-Yi, Taiwan","Jurutungo, Renacimiento, Panama",Light,60/84,"NT $1,000/4 ounces",December 2021,9,9,9,9,8,,
Philippines Sitio Belis,Paradise Roasters,93,"Minneapolis, Minnesota","Benguet, Philippines",Medium-Light,60/78,$20.00/6 ounces,November 2021,9,9,8,9,8,,
Ethiopia Bedessa,Jaunt Coffee Roasters,92,"San Diego, California","Guji Zone, southern Ethiopia",Medium-Light,60/76,$25.00/12 ounces,November 2021,9,9,8,9,7,,
Espresso,Hula Daddy Kona Coffee,94,"Holualoa, Hawai’i","Holualoa, North Kona growing district, “Big Island” of Hawai’i",Medium-Light,56/80,$62.95/8 ounces,November 2021,9,,9,9,8,9,
Kona Mocca®,Hula Daddy Kona Coffee,95,"Holualoa, Hawai’i","Holualoa, North Kona growing district, “Big Island” of Hawai’i",Medium-Light,57/78,$89.95/8 ounces,November 2021,9,9,9,9,9,,
Karen J Kona Red Bourbon,Hula Daddy Kona Coffee,95,"Holualoa, Hawai’i","Holualoa, North Kona growing district, “Big Island” of Hawai’i",Medium-Light,56/78,$49.95/8 ounces,November 2021,9,9,9,9,9,,
Kenya Gachatha Nyeri,Temple Coffee Roasters,93,"Sacramento, California","Nyeri growing region, south-central Kenya",Medium-Light,58/76,$23.50/12 ounces,November 2021,9,8,9,9,8,,
Ethiopia Gora Kone Sidamo,Temple Coffee Roasters,92,"Sacramento, California","Sidamo (also Sidama) growing region, south-central Ethiopia",Medium-Light,57/79,$20.00/12 ounces,November 2021,9,8,8,9,8,,
Holiday Coffee,Hula Daddy Kona Coffee,96,"Holualoa, Hawaii","Holualoa, North Kona growing district, “Big Island” of Hawai’i",Medium-Light,58/80,$49.95/8 ounces,November 2021,9,9,9,10,9,,
Mama Cata Mokkita,Paradise Roasters,97,"Minneapolis, Minnesota","Boquete growing region, western Panama",Medium-Light,57/79,$150.00/4 ounces,November 2021,10,9,9,10,9,,
Laura’s Reserve SL34,Hula Daddy Kona Coffee,96,"Holualoa, Hawai’i","Holualoa, North Kona growing district, “Big Island” of Hawai’i",Medium-Light,60/78,$62.95/8 ounces,November 2021,9,9,9,10,9,,
Puna Arakawa Estate Lactic Natural,Paradise Roasters,95,"Minneapolis, Minnesota","Kurtistown, Puna, “Big Island” of Hawai’i",Medium-Light,60/78,$30.00/4 ounces,November 2021,9,9,9,9,9,,
100% Kona Bourbon Pointu Laurina,Hula Daddy Kona Coffee,95,"Holualoa, Hawaii","Holualoa, North Kona growing district, “Big Island” of Hawai’i",Medium-Light,56/78,$62.95/8 ounces,November 2021,9,9,9,9,9,,
Colombia Planadas Tolima,Jaunt Coffee Roasters,93,"San Diego, California","Tolima Department, Colombia",Light,63/83,$23.00/12 ounces,November 2021,9,8,9,9,8,,
Colombia Java El Eden,Durango Coffee Company,94,"Durango, Colorado","Tolima Department, Colombia",Medium-Light,58/78,$19.95/12 ounces,November 2021,9,9,9,9,8,,
Ethiopia Buno Dambi Uddo,Jaunt Coffee Roasters,94,"San Diego, California","Odo Shakiso District, Western Guji, Ethiopia",Light,65/83,$25.00/12 ounces,November 2021,9,9,9,9,8,,
Magnolia Blend Espresso,Magnolia Coffee,93,"Charlotte, North Carolina",Papua New Guinea; Costa Rica,Medium-Light,52/72,$16.00/12 ounces,November 2021,9,,8,9,8,9,
Ethiopia Durato Bombe Natural,Oceana Coffee,94,"Tequesta, Florida","Bombe mountains, Sidama Region, southern Ethiopia",Light,64/80,$22.00/12 ounces,November 2021,9,9,9,9,8,,
SÖT Coffee Roaster Colombia Wush Wush Dynamic Natural,SOT Coffee Roaster,96,"Osaka, Japan","San Augustín, Huila Department, Colombia",Light,76/92,¥1680/100 grams,November 2021,10,9,9,10,8,,
Guatemala Santa Felisa Wild Yeast Natural Gesha,Kakalove Cafe,96,"Chia-Yi, Taiwan","Acatenango growing region, central Guatemala",Light,62/88,NT $375/4 ounces,November 2021,9,9,9,10,9,,
Colombia Granja La Esperanza Las Margaritas Gesha Honey,PT's Coffee Roasting Co.,95,"Topeka, Kansas","Caicedonia, Valle del Cauca Department, Colombia",Light,62/80,$60.00/8 ounces,November 2021,9,9,9,9,9,,
Colombia La Palma Y El Tucán Gesha Natural,Equator Coffees,94,"San Rafael, California","Cundinamarca Department, central Colombia",Medium-Light,56/72,$40.00/4 ounces,November 2021,9,9,9,9,8,,
Peru Yanesha Geisha Washed Anaerobic,GK Coffee,94,"Yilan, Taiwan","Pasco Department, Villa Rica, Peru",Medium-Light,59/77,NT $800/100 grams,November 2021,9,9,9,9,8,,
Costa Rica La Rejolla Washed Geisha,Willoughby's Coffee & Tea,94,"Branford, Connecticut","Lourdes de Naranjo, West Valley, Costa Rica",Medium-Light,58/80,$49.99/16 ounces,November 2021,9,9,9,9,8,,
Bekele Heto Natural Ethiopia,JBC Coffee Roasters,95,"Madison, Wisconsin","Worka-Sakaro, Gedeb District, Gedeo Zone",Medium-Light,58/80,$19.00/12 ounces,November 2021,9,9,9,9,9,,
Ethiopia Guji Mormora Organic Natural,RamsHead Coffee Roasters,94,"Bozeman, Montana","Guji Zone, southern Ethiopia",Light,62/80,$18.95/12 ounces,November 2021,9,9,9,9,8,,
Chelbesa Ethiopia,JBC Coffee Roasters,95,"Madison, Wisconsin","Chelchele, Gedeb District, Gedeo Zone, Ethiopia",Medium-Light,58/78,$18.00/8 ounces,November 2021,9,9,9,9,9,,
Colombia La Riviera Sudan Rume,RamsHead Coffee Roasters,94,"Bozeman, Montana","Risaralda, Caldas Department, Colombia",Medium-Light,58/76,$11.99/4 ounces,November 2021,9,9,9,9,8,,
Alaka Ethiopia,JBC Coffee Roasters,94,"Madison, Wisconsin","Hambela Wamena, Guji Zone, Oromia, Ethiopia",Medium-Light,62/78,$18.00/12 ounces,November 2021,9,9,9,9,8,,
Kona Liberica Champagne Natural,Paradise Roasters,93,"Minneapolis, Minnesota","Kona, Big Island of Hawai’i",Medium-Light,60/76,$50.00/4 ounces,November 2021,9,8,9,9,8,,
El Triunfo Mexico,JBC Coffee Roasters,93,"Madison, Wisconsin","Sierra Madre, Chiapas, Mexico",Medium-Light,56/78,$16.00/12 ounces,November 2021,9,9,8,9,8,,
Out of Africa Blend,RamsHead Coffee Roasters,92,"Bozeman, Montana",Kenya; Ethiopia,Medium-Light,58/78,$17.95/12 ounces,November 2021,9,8,8,9,8,,
Ethiopia Natural Guji Hambela SASA Lot 10,Kakalove Cafe,93,"Chia-Yi, Taiwan","Guji Zone, Oromia Region, Southern Ethiopia",Light,62/80,NT $325/8 ounces,October 2021,9,8,9,9,8,,
Acatenango Santa Felisa Wild Yeast Natural Sudan Rume Full Moon Lot 4,Kakalove Cafe,94,"Chia-Yi, Taiwan","Acatenango growing region, central Guatemala",Medium-Light,60/76,NT $600/8 ounces,October 2021,9,9,9,9,8,,
Guatemala Finca El General Slow Dry 6,Kakalove Cafe,94,"Chia-Yi, Taiwan","Acatenango growing region, central Guatemala",Medium-Light,58/78,NT $375/8 ounces,October 2021,9,9,9,9,8,,
Ethiopia Yirgacheffe Washed Banko Gotiti 3,Kakalove Cafe,94,"Chia-Yi, Taiwan","Kochere, Yirgacheffe growing region, south-central Ethiopia",Medium-Light,58/80,NT $275/8 ounces,October 2021,9,9,9,9,8,,
Ethiopia Natural Yirgacheffe Adado Feysa Dira,Kakalove Cafe,94,"Chia-Yi, Taiwan","Yirgacheffe growing region, south-central Ethiopia",Medium-Light,58/76,NT $280/8 ounces,October 2021,9,9,9,9,8,,
Guatemala Finca El General SummerEnd Espresso,Kakalove Cafe,94,"Chia-Yi, Taiwan","Acatenango growing region, Guatemala",Medium-Light,52/72,NT $225/8 ounces,October 2021,9,,9,9,8,9,
Guatemala El Injerto Natural Legendary Gesha 7,Kakalove Cafe,95,"Chia-Yi, Taiwan","La Libertad, Huehuetenango Department, Guatemala",Light,62/80,NT $600/4 ounces,October 2021,9,9,9,9,9,,
Kenya Athena AB Espresso,Simon Hsieh Aroma Roast Coffees,94,"Taoyuan, Taiwan","Nyeri growing region, south-central Kenya",Medium,46/60,NT $850/8 ounces,October 2021,9,,9,9,8,9,
Kenya Gichathaini,Roadmap CoffeeWorks,95,"Lexington, Virginia","Mathira West District, Nyeri growing region, Kenya",Medium-Light,60/78,$24.95/12 ounces,October 2021,9,9,9,9,9,,
Indonesian Island Blend,Mystic Monk Coffee,92,"Meeteetse, Wyoming","Java, Flores and Sumatra, Indonesia",Medium,50/68,$14.99/12 ounces,October 2021,8,8,9,9,8,,
Banko Gotiti Natural,JBC Coffee Roasters,93,"Madison, Wisconsin","Kochere, Yirgacheffe growing region, Ethiopia",Medium-Light,60/78,$20.00/12 ounces,October 2021,9,8,9,9,8,,
FTO Ethiopian,Mystic Monk Coffee,92,"Meeteetse, Wyoming","Yirgacheffe growing region, southern Ethiopia",Medium-Light,52/70,$13.95/12 ounces,October 2021,9,8,8,9,8,,
Yemen Sheba Auction Lot 1: Wadi Al Mahjr,Euphora Coffee,95,"Taipei, Taiwan","Al Mahjr, Al Hayma District, Yemen",Medium-Light,56/78,NT $500/4 ounces,October 2021,9,9,9,9,9,,
Yemen Sana’a,Equator Coffees,93,"San Rafael, California","Sana’a Governorate, Yemen",Light,62/84,$32.00/6 ounces,October 2021,9,8,9,9,8,,
Port of Mokha Auction Lot 19: Mohamed Ahmed Al Rumaim,Euphora Coffee,92,"Taipei, Taiwan","Al Hayma District, Sana’a Governorate, Yemen",Medium-Light,60/77,NT $760/4 ounces,October 2021,9,8,8,9,8,,
Honduras Finca Las Moras Parainema Yellow Honey,RamsHead Coffee Roasters,93,"Bozeman, Montana","Siguatepeque, Comayagua Department, Honduras",Medium-Light,58/76,$16.95/12 ounces,October 2021,9,8,9,9,8,,
Colombia La Esperanza Potosí Anaerobic Process,Durango Coffee Company,94,"Durango, Colorado","Caicedonia, Valle de Cauca Department, Colombia",Medium-Light,57/73,$18.95/12 ounces,October 2021,9,9,9,9,8,,
Peru Finca Churupampa,RamsHead Coffee Roasters,93,"Bozeman, Montana","Chirinos, San Ignacio Province, Peru",Medium-Light,56/76,$16.95/12 ounces,October 2021,9,8,9,9,8,,
Strawberry Forest,David's Nose,92,"Taipei, Taiwan",Ethiopia; Nicaragua,Medium-Light,57/75,NT $450/8 ounces,October 2021,9,,9,9,7,8,
Ethiopia Natural Guji Sweet Lady,David's Nose,93,"Taipei, Taiwan","Guji Zone, Oromia Region, southern Ethiopia",Medium-Light,60/80,NT $400/8 ounces,October 2021,9,8,9,9,8,,
Panama Hacienda La Esmeralda Ethiopia Accessions,Paradise Roasters,95,"Minneapolis, Minnesota","Boquete growing region, western Panama",Light,62/82,$24.95/4 ounces,October 2021,9,9,9,9,9,,
The Natural,Barrington Coffee Roasting,93,"Lee, Massachusetts","Banti Nenga, Oromia Region, Ethiopia",Medium-Light,52/70,$16.95/12 ounces,October 2021,9,,9,9,8,8,
Guji Hamasho Washed,Paradise Roasters,94,"Minneapolis, Minnesota","Bombe Mountains, Sidama growing region, Ethiopia",Medium-Light,56/82,$24.95/12 ounces,October 2021,9,9,9,9,8,,
Kona Red Wine Process,Paradise Roasters,94,"Minneapolis, Minnesota","Kona, Big Island of Hawai’i",Medium-Light,56/76,$24.95/4 ounces,October 2021,9,9,9,9,8,,
Candelilla Geisha Natural,JBC Coffee Roasters,95,"Madison, Wisconsin","Tarrazu growing region, Costa Rica",Light,62/80,$21.50/8 ounces,September 2021,9,9,9,9,9,,
Kiamugumo Kenya,JBC Coffee Roasters,95,"Madison, Wisconsin","Kirinyaga County, south-central Kenya",Medium-Light,58/80,$21.00/12 ounces,September 2021,9,9,9,9,9,,
Ethiopia Sidama Ardi,Equator Coffees,95,"San Rafael, California","Guji Zone, Borena Hagermariam District, Ethiopia",Light,64/86,$19.00/12 ounces,September 2021,9,9,9,9,9,,
Colombia Gesha,SkyTop Coffee,94,"Manlius, New York","Aratoca, Santander Department, Colombia",Medium-Light,60/77,$27.00/12 ounces,September 2021,9,9,9,9,8,,
Ethiopia Kayon Mountain Washed,Roadmap CoffeeWorks,94,"Lexington, Virginia","Odo Shakiso District, Guji Zone, southern Ethiopia",Medium-Light,60/78,$19.95/12 ounces,September 2021,9,9,9,9,8,,
Ethiopia Kayon Mountain Natural,Roadmap CoffeeWorks,93,"Lexington, Virginia","Odo Shakiso District, Guji Zone, southern Ethiopia",Medium-Light,60/78,$19.95/12 ounces,September 2021,9,8,9,9,8,,
Ethiopia Gedeb Worka Wuri,Jaunt Coffee Roasters,95,"San Diego, California","Gedeb District, Gedeo Zone, southern Ethiopia",Light,62/80,$26.00/12 ounces,September 2021,9,9,9,9,9,,
Kenya Muranga Riakiberu,Jaunt Coffee Roasters,92,"San Diego, California","Murang'a County, central Kenya",Medium-Light,58/76,$24.00/12 ounces,September 2021,9,8,8,9,8,,
Kenya Karatina,Temple Coffee Roasters,94,"Sacramento, California","Nyeri County, Kenya",Medium-Light,56/74,$23.50/12 ounces,September 2021,9,9,9,9,8,,
La Reforma El Salvador Natural,JBC Coffee Roasters,94,"Madison, Wisconsin","Calzontes Arriba, Santa Ana Department, El Salvador",Medium-Light,58/77,$20.50/12 ounces,September 2021,9,9,9,9,8,,
Ethiopia Gogogu Bekaka #4,Jackrabbit Java,93,"Thermopolis, Wyoming","Yirgacheffe growing region, southern Ethiopia",Medium-Light,56/78,$16.00/12 ounces,September 2021,9,9,8,9,8,,
Mexico Pluma Hidalgo,Temple Coffee Roasters,93,"Sacramento, California","Pluma Hidalgo, Oaxaca State, Mexico",Medium-Light,54/74,$23.50/12 ounces,September 2021,9,8,9,9,8,,
Bella Carmona Guatemala,JBC Coffee Roasters,92,"Madison, Wisconsin","Antigua growing region, Guatemala",Light,62/80,$17.00/12 ounces,September 2021,9,8,8,9,8,,
Pluma Hidalgo Mexico,JBC Coffee Roasters,92,"Madison, Wisconsin","Pluma Hidalgo, Oaxaca State, Mexico",Medium-Light,60/78,$16.00/12 ounces,September 2021,9,8,8,9,8,,
Guatemala COE-NW#2 Sierra Roja Geisha Washed,GK Coffee,96,"Yilan, Taiwan","San Cristobal Acasaguastlán, El Progreso, Sierra de las Minas, Guatemala",Medium-Light,60/80,NT $600/100 grams,September 2021,9,10,9,9,9,,
Guatemala El Injerto Pacamara,Equator Coffees,93,"San Rafael, California","La Libertad, Huehuetenango Department, Guatemala",Medium-Light,57/74,$19.00/6 ounces,September 2021,9,8,9,9,8,,
Guatemala Finca El Principito Yellow Catuai,Kakalove Cafe,93,"Chia-Yi, Taiwan","Fraijanes, central Guatemala",Medium-Light,60/80,NT $260/8 ounces,September 2021,9,8,9,9,8,,
Guatemala Finca San Gerardo,Magnolia Coffee,92,"Charlotte, North Carolina","Lake Amatitlán region, south-central Guatemala",Medium-Light,54/74,$15.00/12 ounces,September 2021,9,8,8,9,8,,
Ethiopia Guji Laayoo Natural,Paradise Roasters,95,"Minneapolis, Minnesota","Uraga District, Guji Zone, Ethiopia",Light,64/84,$24.95/12 ounces,August 2021,9,9,9,9,9,,
Nicaragua La Bendicion Yellow Maracaturra Natural,Paradise Roasters,94,"Minneapolis, Minnesota","Nueva Segovia, Nicaragua",Light,64/86,$14.95/6 ounces,August 2021,9,9,9,9,8,,
Kona Lactic Washed,Paradise Roasters,94,"Minneapolis, Minnesota","Kona, Big Island of Hawai’i",Medium-Light,60/76,$24.95/4 ounces,August 2021,9,8,9,9,9,,
Ecuador Hacienda Legrand Robusta,Paradise Roasters,93,"Minneapolis, Minnesota","Santa Elena Province, Ecuador",Medium-Light,54/72,$18.95/12 ounces,August 2021,9,,9,9,9,7,
El Salvador Pacamara,RamsHead Coffee Roasters,93,"Bozeman, Montana","Ahuachapan, El Salvador",Medium-Light,54/72,$17.95/12 ounces,August 2021,9,8,9,9,8,,
GK Classic Manba Blend Espresso,GK Coffee,93,"Yilan, Taiwan",Indonesia; Brazil,Medium,46/62,NT $250/227 grams,August 2021,9,,8,9,8,9,
Nicaragua Jinotega Hacienda La Bastilla Blue Candy Natural,RamsHead Coffee Roasters,92,"Bozeman, Montana","Jinotega, Nicaragua",Medium-Light,58/76,$17.95/12 ounces,August 2021,9,8,8,9,8,,
Ethiopia Guji Natural Euphora Special Lot,Euphora Coffee,94,"Taipei, Taiwan","Guji Zone, Oromia Region, Southern Ethiopia",Medium-Light,59/79,NT $320/8 ounces,August 2021,9,9,9,9,8,5,
Sudan Rume,JBC Coffee Roasters,95,"Madison, Wisconsin","Valle del Cauca Department, Colombia",Medium-Light,57/74,$30.00/8 ounces,August 2021,9,9,9,9,9,,
Testi Ayla Double Ethiopia,Barrington Coffee Roasting,97,"Lee, Massachusetts","Sidama Zone, Oromia Region, Ethiopia",Light,64/86,$54.95/12 ounces,August 2021,9,10,9,10,9,,
Primavera Colombia Espresso,JBC Coffee Roasters,94,"Madison, Wisconsin","Huila Department, Colombia",Medium-Light,58/78,$19.00/12 ounces,August 2021,9,,9,9,8,9,
Andi Sumatra,JBC Coffee Roasters,93,"Madison, Wisconsin","Aceh Province, Sumatra",Medium-Light,58/76,$19.50/12 ounces,August 2021,9,8,9,9,8,,
Gigesa Ethiopia,JBC Coffee Roasters,94,"Madison, Wisconsin","Guji Zone, Oromia Region, Ethiopia",Light,62/80,$18.00/12 ounces,August 2021,9,9,9,9,8,,
Guatemala Buena Vista Single-Origin Espresso,Temple Coffee Roasters,93,"Sacramento, California","Chimaltenango, Guatemala",Medium-Light,56/72,$22.50/12 ounces,August 2021,9,,8,9,8,9,
Ethiopia Reko Yirgacheffe,Temple Coffee Roasters,93,"Sacramento, California","Yirgacheffe growing region, southern Ethiopia",Medium-Light,60/76,$20.50/12 ounces,August 2021,9,9,8,9,8,,
Medina Natural,JBC Coffee Roasters,93,"Madison, Wisconsin","Antigua growing region, Guatemala",Medium-Light,58/76,$20.50/12 ounces,August 2021,9,8,9,9,8,,
Sadah Kuhlani Yemen,Barrington Coffee Roasting,93,"Lee, Massachusetts","Sa’dah Governorate, Yemen",Light,62/80,$39.95/12 ounces,August 2021,9,8,9,9,8,,
Gura Kenya,JBC Coffee Roasters,93,"Madison, Wisconsin","Nyeri growing region, Kenya",Medium-Light,58/77,$22.00/12 ounces,August 2021,9,8,9,9,8,,
Ethiopia Nano Genji,Temple Coffee Roasters,92,"Sacramento, California","Guji Zone, Oromia Region, southern Ethiopia",Medium-Light,58/76,$21.50/12 ounces,August 2021,9,8,8,9,8,,
Durango Espresso,Durango Coffee Company,91,"Durango, Colorado",Not disclosed,Medium,45/59,$13.20/12 ounces,August 2021,8,,8,8,8,9,
Espresso Nuevo,Paradise Roasters,93,"Minneapolis, Minnesota",Colombia; Brazil; Indonesia,Medium,45/61,$14.95/12 ounces,August 2021,9,,8,9,8,9,
Golden Parrot Blend,Kakalove Cafe,95,"Chia-Yi, Taiwan",Guatemala; Colombia; Ethiopia,Medium,50/67,NT $210/8 ounces,August 2021,9,,9,9,9,9,
Bull Demon King,Simon Hsieh Aroma Roast Coffees,96,"Taoyuan, Taiwan",Colombia; Peru; Rwanda; Ethiopia,Medium-Dark,35/48,NT $550/8 ounces,August 2021,9,,9,9,9,10,
Dharma Espresso Blend,Temple Coffee Roasters,92,"Sacramento, California",Brazil; Ethiopia; Colombia,Medium,46/60,$16.50/12 ounces,August 2021,8,,9,8,8,9,
Tanzania Gesha Peaberry,Paradise Roasters,95,"Minneapolis, Minnesota","Ngorongoro, Tanzania",Light,62/80,$74.95/4 ounces,August 2021,9,9,9,9,9,,
Ethiopia Natural Guji D Minor 21/01,Kakalove Cafe,95,"Chia-Yi, Taiwan","Guji Zone, Oromia Region, Southern Ethiopia",Light,64/84,NT $375/8 ounces,August 2021,9,9,9,9,9,,
Ethiopia Hambela Yellow Honey James Selection,Kakalove Cafe,95,"Chia-Yi, Taiwan","Guji Zone, Oromia Region, southern Ethiopia",Light,62/80,NT $410/8 ounces,August 2021,9,9,9,9,9,,
Costa Rica Black Honey,Kakalove Cafe,94,"Chia-Yi, Taiwan",Costa Rica,Medium-Light,58/76,NT $275/8 ounces,August 2021,9,9,9,9,8,,
Costa Rica La Florida Red Honey Espresso,Kakalove Cafe,95,"Chia-Yi, Taiwan","Copey District, Costa Rica",Medium-Light,54/78,NT $300/8 ounces,August 2021,9,,9,9,9,9,
Blue Sky Breakfast Blend,Paradise Roasters,93,"Minneapolis, Minnesota",Not disclosed,Medium-Light,58/76,$14.95/12 ounces,August 2021,9,8,9,9,8,,
Ethiopia Yirgacheffe Botabaa Washed G1 21/01,Kakalove Cafe,94,"Chia-Yi, Taiwan","ochere Woreda, Gedeo Zone, Ethiopia",Medium-Light,60/80,NT $290/8 ounces,August 2021,9,9,9,9,8,,
Costa Rica Black Honey,Kakalove Cafe,94,"Chia-Yi, Taiwan",Costa Rica,Medium-Light,58/76,NT $275/8 ounces,August 2021,9,9,9,9,8,,
Colombia Black Condor,Durango Coffee Company,91,"Durango, Colorado","Vereda, Huila Province, Colombia",Medium-Light,56/74,$19.95/12 ounces,July 2021,8,8,8,9,8,,
Kabiufa Papua New Guinea,JBC Coffee Roasters,94,"Madison, Wisconsin","Kabiufa, Eastern Highlands, Papua New Guinea",Light,60/82,$16.00/12 ounces,July 2021,9,9,9,9,8,,
Colombia Finca Santa Maria,SkyTop Coffee,95,"Manlius, New York","Aratoca, Santander Department, Colombia",Medium-Light,58/78,$18.00/12 ounces,July 2021,9,9,9,9,9,,
